{
  "schema": "wtfp.evaluation.identity-receipt/v1",
  "client": {
    "name": "Clio Coder",
    "actual_version": "0.3.8",
    "binary_sha256": "f02f31c7480ac4f9532980f8df93e07816111626bdce9879e1ee9e98fd3ec162"
  },
  "model": {
    "provider": "lmstudio",
    "actual_id": "qwen3.8-27b",
    "actual_version": "wire-id-only:qwen3.8-27b"
  },
  "effort": {
    "requested": "off",
    "effective": "off"
  },
  "provenance": {
    "kind": "client-version-and-native-events",
    "source_sha256s": [
      "5e4e3b8278270bb0f30fcd5e8a0f3acab5b438e227697d7ec157d1d9b89baa6b",
      "03eebff0d17c1dbfdb87d6b69e6d8c28c811c8832d2c5a17133db5a30c884eec"
    ]
  }
}
